Date,day,month,year,Close Before,Before_change,SA_T,SA_S,Title,Content,summary,Label
2009-09-10,10,9,2009,29.38999938964844,0.0,0.5994,-0.128,European shares hit 11-month high; media tech boost,* FTSEurofirst 300 up 0.4 percent hits 11-month high  * Technology shares advance ASML leads  * Retailers lose ground Kesa Electricals slips  By Atul Prakash  LONDON Sept 10...,FTSEurofirst 300 up 0.4 percent hits 11-month high * Technology shares advance AS,0.0
2009-10-14,14,10,2009,31.64999961853028,0.07689691309343272,0.8555,0.6633,Strong tech bank shares boost European equities | European shares hit year high; oils miners soar,* FTSEurofirst 300 jumps 1.4 percent; targets 1-year high  * Banks advance; sector index up 170 percent from March lows  * ASML results boost tech stocks; miners in demand   * For... | * FTSEurofirst 300 rises 2.2 percent; hits 1-year high  * Weak dollar boosts oil metals prices  * Banks extend gains after JP Morgan  * BASF up on upbeat outlook  * Intel ASML...,* FTSEurofirst 300 jumps 1.4 percent; targets 1-year high * Banks advance; sector index up 170 percent from March lows,0.0
2010-10-13,13,10,2010,30.56999969482422,-0.03412322074954299,0.296,0.743,U.S. Fed drives European shares up; techs rise,* FTSEurofirst 300 index gains 1 percent  * Tech shares given a boost by Intel; ASML on results  * Standard Chartered slips on right issue  * For up-to-the minute market news...,FTSEurofirst 300 index gains 1 percent . tech shares given a boost by Intel,1.0
2010-12-09,9,12,2010,35.16999816894531,0.15047427281786718,0.8519,0.8885,European shares boosted by technology banks | European shares hit 26-month high; techs gain,* FTSEurofirst 300 index up 0.3 percent  * ASML jumps on Q4 bookings forecast  * Commods higher on global recovery hopes  * For up-to-the minute market news click on By Joanne... | LONDON Dec 9 (Reuters) - European shares hit a 26-month high on Thursday on optimism the U.S. tax cuts would boost consumption with technology stocks boosted after ASML...,euro shares hit a 26-month high on optimism the u.s. tax cuts would boost consumption with technology stocks boosted after AS,1.0
2011-01-19,19,1,2011,40.09999847412109,0.1401763025830609,-0.4939,0.4404,UPDATE 5-ASML's profits surge on demand for smartphone chips | European stocks drop as earnings fail to fuel rally,* Year net profit 1.022 bln euros vs. 151 mln loss in 2009  * Q4 profits sales orders beat analysts' forecasts  * Q4 net profit of 407 mln euro 8 times the year-ago figure  *... | * FTSEurofirst 300 down 0.5 pct Euro STOXX 50 down 0.3 pct  * Stellar IBM Apple ASML results fail to fuel rally  * Correction seen as indexes getting 'overbought'  * For...,net profit of 407 mln euro 8 times the year-ago figure * | * FTSEurofirst 300 down 0.5 pc,0.0
2016-09-08,8,9,2016,106.33000183105467,1.6516210941922043,0.296,0.296,Samsung Electronics says selling some of its shares in ASML,SEOUL (Reuters) - Tech giant  Samsung Electronics Co Ltd  (KS:005930) said on Thursday it is selling some of its shares in Dutch semiconductor equipment maker ASML Holding NV...,Samsung Electronics Co Ltd (KS:005930) said on Thursday it is selling some,0.0
2016-11-18,18,11,2016,102.55999755859376,-0.035455696487723065,0.5106,0.0,Large- and mid-cap stocks with strong relative volume today,Large-cap names with 5x their normal volume:ASML Holding (AS:ASML) (ASML +1.7%)The Gap (GPS -16.5%)Mid-caps with 5x their normal volume:HRG Group (HRG +3.8%)Grand Canyon Education...,Large-cap names with 5x their normal volume:ASML Holding (AS:AS,1.0
2017-04-19,19,4,2017,130.64999389648438,0.2738884263510484,0.5106,0.296,Chip equipment stocks surge after strong Lam Research ASML results,By Noel Randewich SAN FRANCISCO (Reuters) - Shares of semiconductor equipment suppliers surged on Wednesday after quarterly earnings reports from Lam Research (NASDAQ:LRCX) and...,shares of semiconductor equipment suppliers surged on Wednesday after quarterly earnings reports from Lam Research (NASDAQ:,0.0
2017-10-17,17,10,2017,176.58999633789062,0.35162651808315504,0.0,0.3182,Notable earnings before WednesdayÂs open,ABT ASML MTB MTG NTRS SVU UNF USB For Seeking Alpha's full earnings season calendar click here. Now read: Abbott Labs: Up Up And Away Original article,aBT ASML MTB MTG NTRS SVU UNF USB For,0.0
2017-11-16,16,11,2017,177.91000366210938,0.007474983586799766,0.296,0.296,ASML expects to announce new share buyback plan in January:  CFO,By Eric Auchard and Toby Sterling BARCELONA (Reuters) - Dutch semiconductor equipment supplier ASML is currently buying back its own shares and expects to announce a new buyback...,ASML is currently buying back its own shares and expects to announce a new buyback,1.0
2017-12-11,11,12,2017,171.97999572753906,-0.03333150363951831,0.0,0.4767,ASML Holding Cadence Design Workday among additions to Nasdaq 100,The annual re-ranking of the Nasdaq 100 (NASDAQ:QQQ) will become effective prior to next Monday's market open.Added to the index:  ASML Holdings  (NASDAQ:ASML) Cadence Design...,the annual re-ranking of the Nasdaq 100 (NASDAQ:QQ,1.0
2018-01-09,9,1,2018,183.8300018310547,0.06890339805734791,0.25,0.2023,Advanced Semiconductor Engineering Reports December Monthly Revenue,ASX reported December net revenues of $935M (+18% Y/Y).     ATM net revenue of $455M (+4.1% Y/Y).     Press Release Now read: ASML Holding (AS:ASML) Top Of Semiconductor Food Chain...,ASX reported December net revenues of $935M (+18% Y/Y) ATM,0.0
2018-01-16,16,1,2018,180.8699951171875,-0.016101869577238692,0.0,0.1779,Notable earnings before WednesdayÂs open (1/16/2018),ASML BAC FAST GS USBFor Seeking Alpha's full earnings season calendar click hereNow read: Regarded Solutions Positions For 2018: DGI Is The 'Secret Sauce'Original article,ASML BAC FAST GS USBFor Seeking Alpha's full earnings season calendar,1.0
2018-01-17,17,1,2018,186.3800048828125,0.030463923892158018,0.2263,0.5106,Semiconductor stocks moving after ASML Ichor news | B. Riley raises ASML price target recommends AMAT and Lam Research,Semiconductor equipment stocks are on the move following ASMLÂs (ASML +6%) premarket earnings report and IchorÂs (ICHR +8.1%) upside prelim results and guidance.Movers:... | B. Riley raises its ASML (ASML +7.5%) price target from $166 to $200 following the premarket earnings report.               Firm says ASML exited CY17 with a strong Q4 beat...,stocks are on the move following ASML's (ASML +6%) premarket earnings report and Ichors,1.0
2018-04-17,17,4,2018,206.6999969482422,0.10902452802384022,0.0,0.0,Notable earnings before WednesdayÂs open,ABT ASML MS MTG TXT USB     For Seeking Alpha's full earnings season calendar click here. Now read: Philip Morris Gets  Morgan Stanley  In Its CornerOriginal article,ABT ASML MS MTG TXT USB For Seeking Alpha's full earnings,0.0
2018-07-17,17,7,2018,200.0800018310547,-0.032027069254602636,0.0,0.0,Notable earnings before WednesdayÂs open,ABT ASML ERIC GWW MS MTB MTG NTRS NVS TXT USB     For Seeking Alpha's full earnings season calendar click here. Now read: ASML: Extreme Upside Potential - Part 1 Of...,ABT ASML ERIC GWW MS MTB MTG NTRS NVS,1.0
2018-10-16,16,10,2018,173.35000610351562,-0.13359653879906286,0.0,0.0,Notable earnings before WednesdayÂs open,ABT ASML BMI MTB MTG NTRS UNF USB WGOFor Seeking Alpha's full earnings season calendar click here. Now read: Is Wednesday D-Day For Winnebago?Original article,ABT ASML BMI MTB MTG NTRS UNF USB WGOFor,1.0
2018-10-17,17,10,2018,181.72000122070312,0.04828378899617336,0.296,0.296,European shares seek footing as earnings roll in; autos down,By Danilo Masoni MILAN (Reuters) - European shares inched higher on Wednesday led by technology stocks as some upbeat earning updates including from semiconductor bellwether ASML...,european shares inched higher on Wednesday as some upbeat earning updates including from semiconductor bellwether,0.0
2019-04-17,17,4,2019,203.6199951171875,0.12051504374516453,-0.2263,0.0,ASML Holding Earnings Beat Revenue Misses In Q1,Investing.com - ASML Holding (AS:ASML) reported first quarter earnings  that Beat analysts' expectations on Wednesday and revenue that fell short of forecasts. The firm reported...,Investing.com-ASML Holding (AS:ASML) reported first quarter,1.0
2019-07-17,17,7,2019,205.0,0.006777354463731733,0.0,0.0,ASML Holding Earnings Beat Revenue Inline In Q2,Investing.com - ASML Holding (AS:ASML) reported second quarter earnings  that beat analysts' expectations on Wednesday and revenue that was inline with forecasts. The firm...,Investing.com - ASML Holding (AS:ASML) reported second,1.0
2019-10-16,16,10,2019,267.5400085449219,0.305073212414253,-0.2263,0.0,ASML Holding Earnings inline Revenue Misses In Q3,Investing.com - ASML Holding (AS:ASML) reported third quarter earnings  that matched analysts' expectations on Wednesday and revenue that fell short of forecasts. The firm reported...,Investing.com-ASML Holding (AS:ASML) reported third quarter,0.0
2020-01-15,15,1,2020,302.54998779296875,0.1308588552361074,-0.4588,-0.4404,Chinese ambassador warns Dutch government against restricting ASML supplies,AMSTERDAM (Reuters) - Trade relations between China and the Netherlands would be damaged if Dutch semiconductor equipment supplier ASML (AS:ASML) is not allowed to ship its newest...,china and the Netherlands would be damaged if Dutch semiconductor equipment supplier ASML is not allowed to,0.0
2020-07-15,15,7,2020,396.8299865722656,0.3116179229324958,-0.1531,-0.296,ASML Holding Earnings Revenue Miss in Q2,Investing.com - ASML Holding (NASDAQ:ASML) reported on Wednesday second quarter earnings  that missed analysts' forecasts and revenue that fell short of expectations. ASML Holding...,analysts' forecasts and revenue fell short of expectations . NASDAQ:ASML Holding,0.0
2020-10-14,14,10,2020,405.1499938964844,0.020966175958841315,0.0,0.34,StockBeat: ASML Gets a Lift From Apple's Marketing Machine | ASML Holding Earnings Revenue Beat in Q3,By Geoffrey SmithÂ  Investing.com --Â Amid all the ballyhoo about AppleÂs new 5G-enabled iPhones investors are also giving it up for the company that made them possible. ASML... | Investing.com - ASML Holding (NASDAQ:ASML) reported on Wednesday third quarter earnings  that beat analysts' forecasts and revenue that topped expectations. ASML Holding announced...,investors are giving up for the company that made them possible . analysts' forecasts and revenue that topped expectations topped,0.0
2021-01-20,20,1,2021,549.5,0.35628781507620366,0.5859,0.7906,ASML Holding Earnings Revenue Beat in Q4 | Luxury stocks ASML lift European shares in early trading | European Stocks Higher; ASML Helps Chipmakers Higher,Investing.com - ASML Holding (NASDAQ:ASML) reported on Wednesday fourth quarter earnings  that beat analysts' forecasts and revenue that topped expectations. ASML Holding... | (Reuters) - European stocks rose on Wednesday after Swiss luxury group Richemont and chip equipment maker ASML gave encouraging earnings updates while investors hoped for a big... | By Peter Nurse Investing.com - European stock markets traded higher Wednesday with positive corporate earnings more than offsetting tighter German restrictions to fight the...,Investing.com - ASML Holding (NASDAQ:ASML) reported on Wednesday fourth quarter earnings that beat analysts' forecasts and revenue that topped expectations ,1.0
2021-02-12,12,2,2021,591.510009765625,0.07645133715309371,0.296,0.6204,European shares dip; ASML ING among early gainers,(Reuters) - European stocks edged lower on Friday on track to end the second straight week of gains as investors awaited more signs of progress in U.S. stimulus measures while...,european stocks edged lower on Friday on track to end the second straight week of gains .,1.0
2021-04-08,8,4,2021,626.5599975585938,0.0592551050942598,0.4404,0.6249,Applied Materials vs. ASML Holding: Which Semiconductor Stock is a Better Buy?,Due to increasing demand for semiconductors for advanced technologies and devices and robust and growing demand from the automobile sector the semiconductor industry is poised for...,the semiconductor industry is poised for a...,1.0
2021-04-21,21,4,2021,616.9400024414062,-0.015353669488432198,0.4215,0.0,ASML Rises on Strong Sales and Margins; Chip Machine Maker Sees High Demand | ASML Holding Earnings Revenue Beat in Q1,By Dhirendra Tripathi Investing.com Â ASML (NASDAQ:ASML) ADRs were up short of 4% in WednesdayÂs premarket after the company reported sales and margins that reflected the extreme... | Investing.com - ASML Holding (NASDAQ:ASML) reported on Wednesday first quarter earnings  that beat analysts' forecasts and revenue that topped expectations. ASML Holding announced...,ASML (NASDAQ:ASML) reported on Wednesday first quarter earnings that beat analysts' forecasts and revenue that ,1.0
2021-05-18,18,5,2021,635.3499755859375,0.029840783660773695,0.4404,0.34,ASML Holding vs. KLA Corp.: Which Semiconductor is a Better Buy?,The semiconductor industry is expected to grow significantly in the coming months driven by higher global demand thanks to the continued advancement of technologies and rising...,the semiconductor industry is expected to grow significantly in the coming months driven by higher global demand thanks to,0.0
2021-06-02,2,6,2021,671.7999877929688,0.05736997498648844,0.4404,0.4588,ASML Holding vs. Intel: Which Semiconductor Stock is a Better Buy?,An acute semiconductor shortage has pushed governments worldwide to invest heavily in the industry to boost chip production given its huge applications in electronics electric...,an acute semiconductor shortage has pushed governments worldwide to invest heavily in the industry to boost chip production,0.0
2021-07-21,21,7,2021,684.0499877929688,0.01823459396039029,-0.2263,0.0,ASML Holding Earnings Beat Revenue Misses In Q2,Investing.com - ASML Holding (NASDAQ:ASML) reported on Wednesday second quarter earnings  that beat analysts' forecasts and revenue that fell short of expectations. ASML Holding...,analysts' forecasts and revenue fell short of expectations . NASDAQ:ASML Holding,1.0
2021-09-09,9,9,2021,857.989990234375,0.254279666026469,0.4404,-0.0516,ASML Holding vs. Broadcom: Which Semiconductor Stock is a Better Buy?,Because the demand for semiconductors is increasing rapidly huge investments are being made by governments and enterprises to address a supply shortage. We think the...,the demand for semiconductors is increasing rapidly huge investments are being made by governments and enterprises to address,1.0
2021-09-28,28,9,2021,835.3099975585938,-0.02643386628506683,0.0516,-0.296,ASML Leads European Tech Lower as Investors Look for Value,By Dhirendra Tripathi Investing.com Â ADRs of ASML (NASDAQ:ASML) tumbled 5.4% on Nasdaq in TuesdayÂs premarket trading leading the broader European technology sector lower amid a...,ADRs of ASML tumbled 5.4% on Nasdaq in premarket trading,0.0
2021-10-20,20,10,2021,800.9600219726562,-0.04112242842338065,-0.4767,0.0,ASML Holding Earnings Beat Revenue Misses In Q3 | ASML Slips as Q3 Sales Near Lower End of Guidance Bookings Fall,Investing.com - ASML Holding (NASDAQ:ASML) reported on Wednesday third quarter earnings  that beat analysts' forecasts and revenue that fell short of expectations. ASML Holding... | By Dhirendra Tripathi Investing.com Â ASML ADRs (NASDAQ:ASML) fell nearly 4% Wednesday as the companyÂs third-quarter net sales of 5.2 billion euro (around $6 billion)...,Investing.com - ASML Holding (NASDAQ:ASML) reported on Wednesday third quarter earnings that,0.0
2021-11-03,3,11,2021,812.02001953125,0.013808426457233791,0.4404,0.5859,Taiwan Semiconductor Manufacturing vs. ASML Holding: Which Chip Stock is a Better Investment?,Increasing government support to ramp up semiconductor production to meet surging demand from various industries should drive the semiconductor industryÂs growth. This...,government support to ramp up production should drive the industry's growth . this is a,1.0
2021-11-18,18,11,2021,859.4600219726562,0.05842220795097108,0.0,0.4215,ASML sees around $2.3 billion of sales in China in 2021 2022,AMSTERDAM (Reuters) -Dutch semiconductor equipment maker ASML said on Thursday the company sees demand for its products remaining strong in China with around 2 billion euros...,ASML sees demand for its products remaining strong in china with around 2 billion euros .,0.0
2022-01-19,19,1,2022,715.22998046875,-0.16781471833077877,0.9457,0.8059,Chip supplier ASML forecasts strong 2022 despite fire hit | Chip supplier ASML forecasts strong 2022 despite fire hit | ASML Holding Earnings Beat Revenue Misses In Q4 | ASML Gains as Robust Chip Demand Secures Bright 2022 Outlook,By Toby Sterling AMSTERDAM (Reuters) - ASML forecast sales growth of 20% in 2022 despite a fire this month at its Berlin plant as the supplier to chipmakers on Wednesday reported... | By Toby Sterling AMSTERDAM (Reuters) - ASML forecast sales growth of 20% in 2022 despite a fire this month at its Berlin plant as the supplier to chipmakers on Wednesday reported... | Investing.com - ASML Holding (NASDAQ:ASML) reported on Wednesday fourth quarter earnings  that beat analysts' forecasts and revenue that fell short of expectations. ASML Holding... | By Dhirendra Tripathi Investing.com Â ASML ADRs (NASDAQ:ASML) traded 3% higher in WednesdayÂs premarket after the maker of chipmaking equipment said revenue will grow around 20% in...,ASML forecast sales growth of 20% in 2022 despite a fire this month at its Berlin plant as the supplier to chipmakers on Wednesday reported... | Investing.com - ASML Holding (NASDAQ:ASML) reported on Wednesday fourth quarter earnings that beat,0.0
2022-04-20,20,4,2022,617.1500244140625,-0.1371306554996583,0.7458,0.7845,ASML Holding Earnings Revenue Miss in Q1 | European shares rebound on earnings boost | ASML Q1 earnings beat forecasts slightly bookings seen strong | ASML Rises After Flagging Capacity Expansion; Rising Costs Hit 1Q EPS,Investing.com - ASML Holding (NASDAQ:ASML) reported on Wednesday first quarter earnings  that missed analysts' forecasts and revenue that fell short of expectations. ASML Holding... | By Anisha Sircar and Susan Mathew (Reuters) -A clutch of positive earnings including from chipmaker ASML and consumer stock Danone helped European shares rebound on Wednesday... | By Toby Sterling AMSTERDAM (Reuters) -ASML Holding NV a key supplier to computer chip makers reported on Wednesday first-quarter sales of 3.5 billion euros ($3.8 billion) and... | By Geoffrey SmithÂ  Investing.com -- ASML (NASDAQ:ASML) reported another strong quarter as the global bottleneck in semiconductors led the Dutch-based lithographer to announce plans...,a clutch of positive earnings including from chipmaker ASML and consumer stock Danone helped european shares rebound on Wednesday . ASML (NASDAQ:ASML) reported another strong quarter as the global bottleneck in semiconductors led the Dutch-based ,1.0
2022-05-20,20,5,2022,526.0,-0.14769508354245398,0.0,0.0,Computer chip giant ASML places big bets on a tiny future,By Toby Sterling VELDHOVEN Netherlands (Reuters) - ASML a semiconductor industry and stock market giant has to think smaller. Or maybe bigger. It is building machines the size...,ASML a semiconductor industry and stock market giant has to think smaller . it is building,1.0
2022-06-15,15,6,2022,491.1700134277344,-0.06621670451001072,0.0,0.0,"Samsung's Lee discusses smooth supply of ""essential"" chip equipment with ASML's Wennink",SEOUL (Reuters) - Samsung Electronics (OTC:SSNLF) Vice Chairman Jay Y. Lee met with ASML Holding (NASDAQ:ASML) NV CEO Peter Wennink on Tuesday to discuss cooperating over the...,Jay Y. Lee met with ASML Holding (NASDAQ:ASML) NV,0.0
2022-07-05,5,7,2022,449.8299865722656,-0.08416643061527429,-0.1027,0.296,ASML shares fall on report US wants to restrict sales to China,AMSTERDAM (Reuters) -Shares in ASML Holding (NASDAQ:ASML) a key supplier of equipment to semiconductor makers fell on Tuesday following a Bloomberg News report that the U.S....,shares in ASML Holding (NASDAQ:ASML) a key supplier of equipment to,0.0
2022-07-20,20,7,2022,498.3599853515625,0.10788520158271053,0.4404,0.25,Semiconductor equipment maker ASML profit rises on record bookings | ASML Holding Earnings Revenue Beat in Q2 | ASML Shares Edge Lower After Annual Revenue Outlook Downgraded,AMSTERDAM (Reuters) -ASML Holding NV reported higher second-quarter net profit on Wednesday amid record new bookings as it kept shipping equipment to clients as fast as possible... | Investing.com - ASML Holding (NASDAQ:ASML) reported on Wednesday second quarter earnings  that beat analysts' forecasts and revenue that topped expectations. ASML Holding... | By Scott Kanowsky  Investing.com -- ASML Holding NV (AS:ASML) has lowered its full-year sales growth outlook as the Dutch semiconductor manufacturer warned of delayed shipment...,ASML Holding (NASDAQ:ASML) reported higher second-quarter net profit on Wednesday amid record new bookings . analysts' forecasts and revenue that topped expectations ,1.0
2022-10-18,18,10,2022,392.2200012207031,-0.212978544126058,0.0,-0.296,ASML to report Q3 earnings as China supply chain questions swirl,AMSTERDAM (Reuters) - Supply chain snags spending cuts by customers and U.S. trade curbs on China are likely to be in focus at ASML Holding (NASDAQ:ASML) NV's quarterly results...,supply chain snags spending cuts by customers and trade curbs on china . ,1.0
2022-10-19,19,10,2022,398.989990234375,0.01726069295956778,0.296,0.4585,ASML Rises After Reporting Record Bookings Downplaying China Sales Risks | ASML shrugs off slowdown U.S. China sanctions reports strong Q3,By Geoffrey Smith Investing.com -- ASML (AS:ASML) stock rose in early trading on Wednesday after the Dutch-based lithographer said it won't be badly affected by the latest U.S.... | By Toby Sterling AMSTERDAM (Reuters) -ASML Holding NV a key equipment supplier to computer chip manufacturers on Wednesday reported better-than-expected third-quarter sales and...,asML (AS:ASML) stock rose in early trading on Wednesday after the lithographer said it won't,1.0
2022-12-13,13,12,2022,609.989990234375,0.5288353220993194,0.0,-0.1027,Dutch chip equipment maker ASML's CEO questions U.S. export rules on China -newspaper,AMSTERDAM (Reuters) -The chief executive of ASML Holding (NASDAQ:ASML) NV the Dutch semiconductor equipment maker on Tuesday questioned whether a U.S. push to get the...,the chief executive of ASML Holding (NASDAQ:ASML) NV questioned whether,1.0
2023-01-25,25,1,2023,670.010009765625,0.09839508925087226,0.6293,0.0,ASML Q1 sales outlook tops forecasts despite near-term uncertainty | ASML beats earnings forecasts sees 2023 growth amid China worries,By Scott Kanowsky Investing.com -- ASML Holding NV (AS:ASML) has predicted that first-quarter sales will come in above analysts' forecasts although the major semiconductor... | By Toby Sterling VELDHOVEN Netherlands (Reuters) -ASML Holding NV Europe's largest technology company beat fourth-quarter earnings forecasts on Wednesday and forecast a rise...,asML Holding NV predicts first-quarter sales will come in above analysts' forecasts . the,1.0
2023-03-09,9,3,2023,619.4000244140625,-0.07553616306309552,-0.6705,0.0,ASML China customers haunted by uncertainty on new Dutch chip export rules,By Toby Sterling and Philip Blenkinsop AMSTERDAM (Reuters) - The Dutch government has not yet defined crucial aspects of new restrictions on chip-technology exports to China...,the Dutch government has not yet defined crucial aspects of new restrictions on chip-technology exports to,0.0
2023-04-17,17,4,2023,666.2000122070312,0.07555696795013911,-0.2732,0.296,ASML Holdings and other chip-parts makers fall on report Taiwan Semi plans to cut capex,By Sam Boughedda  ASML Holdings  (NASDAQ:ASML) shares are down alongside other European semiconductor-equipment makers such as Applied Materials (NASDAQ:AMAT) Lam Research...,shares are down alongside other european semiconductor-equipment makers such as Applied Materials .,0.0
2023-04-19,19,4,2023,643.3300170898438,-0.03432902236285207,0.34,0.6249,'Very well-positioned' ASML Holdings tops earnings estimates misses revenue expectations,By Sam Boughedda  ASML Holdings  (NASDAQ:ASML) shares fell over 3.5% in early Wednesday trading after the company reported first-quarter earnings topping profit expectations but...,shares fell over 3.5% in early Wednesday trading after the company reported first-quarter earnings topping profit,0.0
2023-06-13,13,6,2023,730.1699829101562,0.13498509864834252,0.6249,0.0,AI drives share price: ASML on a good path says JPMorgan,"Investing.com - JPMorgan has maintained its rating on ASML (AS:ASML) at ""Overweight"" and issued a price target of Â690 (Â1 = $1.080). The semiconductor industry equipment...","JPMorgan maintains its rating on ASML (AS:ASML) at ""Over",1.0
2023-06-26,26,6,2023,697.8900146484375,-0.04420884043064066,0.0,-0.296,Dutch human rights body: ASML may follow US export rules when hiring,AMSTERDAM (Reuters) - Dutch computer chip equipment maker ASML may refuse job applicants on the basis of their nationality when required to do so by U.S. export rules a Dutch...,ASML may refuse job applicants on the basis of their nationality when required by U.S,1.0
2023-07-19,19,7,2023,757.030029296875,0.08474116752942695,0.6908,0.4404,ASML second-quarter net profits beat estimates amid strong Chinese demand,Investing.com -- ASMLÂ (AS:ASML)Â posted higher-than-anticipated net profit in the second quarter and lifted its full-year sales guidance as the Dutch semiconductor equipment maker...,asML (AS:ASML) posted higher-than-anticipated net profit,0.0
