Date,day,month,year,Close Before,Before_change,SA_T,SA_S,Title,Content,summary,Label
2021-03-11,11,3,2021,69.5,0.0,0.5423,0.7096,Cathie WoodÂs Magic Touch Lives On as Ark Stake Boosts Roblox | Roblox Up 12% Premarket As Cathie WoodÂs Fund Buys Over 50000 Shares,(Bloomberg) -- A rough period of performance for Cathie Wood hasnÂt diminished her ability to supercharge a stockÂs fortunes if RobloxÂ Corp (NYSE:RBLX) is anything to go by. The... | By Dhirendra Tripathi Investing.com Â Roblox (NYSE:RBLX) shares were up 12% at $78 in premarket trade Thursday extending their gains after their debut a day earlier. The reference...,a rough period of performance for Cathie Wood hasn't diminished her ability to supercharge a stocks fortunes,1.0
2021-03-16,16,3,2021,72.1500015258789,0.03812951835796996,0.0,0.296,Roblox Jumps As Stifel Sets $85 Price Target,By Dhirendra Tripathi Investing.com Â Roblox (NYSE:RBLX) shares rose 7% in TuesdayÂs session after analysts at Stifel put aÂ  ÂbuyÂ rating on them with an $85 target. The stock has...,analysts at the stock put a buy rating on them with an $85,1.0
2021-04-05,5,4,2021,67.33999633789062,-0.06666673716234117,0.34,0.3612,Roblox Gains As Several Analysts Call it a Buy,By Dhirendra Tripathi Investing.com Â Roblox (NYSE:RBLX) shares climbed 4% in MondayÂs trading after a number of Wall Street analysts called it a buy. Â  Roblox went public in March...,a number of Wall Street analysts called it a buy . shares climbed 4%,1.0
2021-04-13,13,4,2021,75.0,0.11375117431955184,0.5267,0.5994,Roblox Hasbro Gain On Deal To Sell Toys Based on Video Games,By Dhirendra Tripathi Investing.com Â Shares of both RobloxÂ Corp (NYSE:RBLX) and  Hasbro Inc  (NASDAQ:HAS) gained on Tuesday as the two struck a deal to create Nerf and Monopoly...,shares of both Roblox Corp (NYSE:RBLX) and Hasbro Inc (,1.0
2021-05-11,11,5,2021,64.0,-0.1466666666666666,0.0,0.3736,Roblox Jumps as Virtual Currency Trumps Actual Sales,By Christiana Sciaudone Investing.com -- Who needs to make real money when you can make virtual money? Hm. Trick question?RobloxÂ Corp (NYSE:RBLX) jumped 7% after the value of its...,Roblox Corp (NYSE:RBLX) jumped 7% after the value of,1.0
2021-05-24,24,5,2021,82.5,0.2890625,0.4404,0.3818,Roblox vs. Skillz: Which Video Game Stock Is a Better Buy?,The gaming industry is expected to grow at a stellar pace going forward making stocks such as Roblox (RBLX) and Skillz (SKLZ) enticing bets for long-term growth investors. .In the...,the gaming industry is expected to grow at a stellar pace going forward . stocks such as,1.0
2021-05-27,27,5,2021,89.70999908447266,0.08739392829663828,0.4404,0.296,Is Roblox a Good Video Game Stock to Add to Your Portfolio?,Online gaming platform provider RobloxÂs (RBLX) shares have been galloping since its stock market debut on March 10 2021. However because childrenÂwho are its target...,online gaming platform provider Robloxs shares have been galloping since its stock market debut,1.0
2021-06-11,11,6,2021,91.0,0.014379678170687082,0.0,-0.2263,Roblox Slips On $200 Million Copyright Suit From Music Labels,By Dhirendra Tripathi Investing.com Â Roblox (NYSE:RBLX) shares fell 1% early on in FridayÂs trading as the company faces a $200 million copyright infringement lawsuit...,Roblox (NYSE:RBLX) shares fell 1% early on in Fridays,0.0
2021-06-16,16,6,2021,89.80000305175781,-0.013186779651013003,0.4588,-0.1531,Roblox Slips As User Base Falls Engagement Slows,By Dhirendra Tripathi Investing.com -- Roblox (NYSE:RBLX) shares lost 8% of their value in premarket trading on Wednesday as weak May numbers of its user base and their slowing...,Roblox (NYSE:RBLX) shares lost 8% of their value in premarket,0.0
2021-08-17,17,8,2021,79.56999969482422,-0.11391985533716908,-0.1531,-0.296,Roblox Drops As Q2 Earnings Miss Estimates July Numbers Mixed,By Dhirendra Tripathi Investing.com Â Roblox stock (NYSE:RBLX) fell 4.7% Tuesday after the companyÂs second-quarter earnings missed estimates while July monthly numbers...,Roblox stock (NYSE:RBLX) fell 4.7% on tues,1.0
2021-10-11,11,10,2021,70.44000244140625,-0.11474170275775242,0.1027,0.7579,Is the Pullback in Roblox an Opportunity or Warning Sign?,The recent success of Squid Game helped online entertainment platform operator Roblox (RBLX) grab the marketÂs attention. However the companyÂs stock has declined in...,the recent success of Squid Game helped online entertainment platform operator Roblox grab the market',1.0
2021-11-01,1,11,2021,84.0199966430664,0.1927880995313187,0.5859,0.34,Roblox Gains as Services Restored After Three-Day Outage,By Dhirendra Tripathi Investing.com Â Roblox stock (NYSE:RBLX) traded 1% higher in MondayÂs premarket a day after the company restored its services ending a three-day...,Roblox stock (NYSE:RBLX) traded 1% higher in Monday's pre,0.0
2021-11-17,17,11,2021,116.18000030517578,0.3827660669725024,0.296,0.0,Roblox Shares Hit High as Morgan Stanley Nods at Early Metaverse Lead,By Sam Boughedda Investing.com Â RobloxÂ Corp (NYSE:RBLX)Â stock hit a new high Wednesday rising 7% to $125.82 after comments from Morgan StanleyÂ analyst Brian Nowak. The analyst...,stock hit a new high Wednesday rising 7% to $125.82 after comments from Morgan,1.0
2021-12-15,15,12,2021,107.66999816894533,-0.07324842583815472,0.0,0.296,Roblox Slides Following November Metrics Data,By Sam Boughedda Investing.com Â RobloxÂ Corp (NYSE:RBLX)Â shares are down 11.6% despite the online game platform's metrics in November showing a rise year on year. Roblox shares...,shares are down 11.6% despite the online game platform's metrics in November showing a,0.0
2021-12-17,17,12,2021,95.20999908447266,-0.11572396485900971,0.0,-0.128,Roblox Gets Buy Rating From Needham,By Sam Boughedda Investing.com Â RobloxÂ Corp (NYSE:RBLX)Â shares rose 6% onÂ  Friday looking to reclaim some of this week's losses following a buy rating from Needham. Roblox shares...,shares rose 6% on friday looking to reclaim some of this week's losses,1.0
2021-12-20,20,12,2021,102.4000015258789,0.07551730396538603,0.0,0.7906,Is Roblox a Buy Around $100?,Leading video gaming platform Roblox (RBLX) has gained huge popularity among children over the past year. However the stock has declined considerably in price over the past month...,video gaming platform Roblox (RBLX) has gained huge popularity among children over the past,1.0
2021-12-23,23,12,2021,102.7699966430664,0.003613233512442804,0.0,0.296,4 Stock Positions Cathie Wood Added to With Size Recently,Renowned investor Cathie WoodÂs risky investment bets delivered substantial returns in 2020. She recently added shares of Roblox (RBLX) UiPath (PATH) Robinhood...,cathie Wood recently added shares of Roblox (RBLX) UiPa,1.0
2022-02-14,14,2,2022,66.80999755859375,-0.34990756309320925,0.34,0.296,Roblox Gains After BofA Reinstates Buy Rating,By Sam Boughedda Investing.com ÂÂ Shares of RobloxÂ Corp (NYSE:RBLX) rose around 2% at the open Monday on the back of comments from BofA analyst Omar Dessouky who described the...,shares of Roblox Corp (NYSE:RBLX) rose around 2% at the,1.0
2022-02-15,15,2,2022,68.31999969482422,0.022601439775628895,0.1531,-0.1531,Roblox Falls as BBC Report Points to Sexual Content in its Games | Roblox Shares Fall 15% After EPS Miss,By Dhirendra Tripathi Investing.com Â Roblox stock (NYSE:RBLX) fell 1% on Tuesday after a BBC report revealed alarming sexual content in some games on the platform. The BBC... | By Sam Boughedda Investing.com --  Roblox Corp  (NYSE:RBLX) shares fell after-hours Tuesday after the company reported its fourth-quarter earnings. Roblox announced a loss per...,a BBC report revealed alarming sexual content in some games on the platform . the company reported its fourth-quarter earnings,0.0
2022-02-16,16,2,2022,73.30000305175781,0.07289232112380795,0.0,-0.128,Roblox Slumps as Frenzy for Video Games Begins to Cool,By Dhirendra Tripathi Investing.com Â RobloxÂ stock (NYSE:RBLX) tumbled 16% as its fourth-quarter numbers disappointed reflecting slowing growth at the gaming platform. The..., Roblox stock (NYSE:RBLX) tumbled 16% .,0.0
2022-03-11,11,3,2022,41.470001220703125,-0.43424284455457973,0.0,0.0,Roblox An Early Leader In Digital Creator Marketplace Says Deutsche Bank,By Sam Boughedda Investing.com --Â  Deutsche Bank Â initiated coverage on RobloxÂ Corp (NYSE:RBLX) Friday assigning a buy rating and a $60 price target implying an approximately 45%...,a buy rating and $60 price target imply an approximately 45% . 45% of,0.0
2022-03-15,15,3,2022,36.68000030517578,-0.11550520314757129,-0.631,0.4019,Roblox February DAUs Up 28% but Benchmark Sees Q1 Downside Risk,By Sam Boughedda Investing.com --Â On Tuesday RobloxÂ Corp. (NYSE:RBLX) reported its metrics for February revealing that daily active users were 55.1 million rising 28%...,daily active users were 55.1 million rising 28% . daily active user averaged 55.1,1.0
2022-04-27,27,4,2022,31.76000022888184,-0.13413304349399635,-0.2732,-0.2263,Roblox Price Target Cut at Morgan Stanley,By Sam Boughedda Investing.com -- RobloxÂ Corp (NYSE:RBLX)Â stock is down Wednesday after Morgan Stanley slashed its price target on the stock to $32 from $65 keeping an Equal...,the stock is down after Morgan Stanley slashed its price target on the stock to $3,1.0
2022-05-05,5,5,2022,34.880001068115234,0.0982368015349111,-0.2732,0.0258,Roblox Price Target Cut By BofA,By Sam Boughedda Investing.com -- RobloxÂ Corp (NYSE:RBLX) shares fell 12.5% on Thursday after BofA analyst Omar Dessouky cut the price target to $46 from $71. In a note to clients...,Roblox shares fell 12.5% on friday after a price target cut to $46,0.0
2022-05-10,10,5,2022,24.61000061035156,-0.29443807750200346,0.1531,-0.5209,Roblox Shares Down 5% on Q1 Miss,Roblox (NYSE:RBLX)Â shares were trading more than 5% lower after-hours following the companyÂs Q1 results with EPS of ($0.27) coming in worse than the consensus estimate of...,shares were trading more than 5% lower after-hours following the company's Q1,0.0
2022-05-11,11,5,2022,23.190000534057617,-0.05770012357076726,0.1139,0.5267,Roblox Stock Reaction Muted Despite Earnings Miss Analysts Weigh In,Shares of Roblox (NYSE:RBLX) initially plunged over 10% in post-market trading after the company reported worse-than-expected Q1 bookings. However shares have recovered since to...,shares of Roblox (NYSE:RBLX) plunged over 10% in post-market,1.0
2022-05-24,24,5,2022,30.059999465942383,0.29624833004187523,-0.1779,-0.5423,Roblox Shares Sink Following Wall Street Downgrade Citing Weak App Download Trends,By Liz Moyer RobloxÂ Corp (NYSE:RBLX)Â shares fell 10% Tuesday after Atlantic Equities analyst Kunaal Malde cut the rating to Neutral from Overweight. Malde cut the price target in...,shares fell 10% after analyst Kunaal Malde cut the rating to Neutral from Overweight,0.0
2022-05-27,27,5,2022,30.59000015258789,0.017631427014694223,-0.296,-0.2732,Roblox Target Cut at Morgan Stanley Expect Pressure on Near-Term Profitability,By Sam Boughedda Investing.com -- RobloxÂ Corp's (NYSE:RBLX)Â price target was cut to $27 from $32 byÂ Morgan Stanley analyst Brian Nowak on Friday. The analyst who maintained an...,Roblox Corp's price target was cut from $32 by analyst Brian Nowak ,0.0
2022-06-15,15,6,2022,26.1200008392334,-0.14612616185215466,0.0,0.296,Roblox Falls After Reporting Slowing of All Major Metrics in May,ByÂ Investing.comÂ Staff Shares of Roblox (NYSE:RBLX) fell 4% in pre-open trading Wednesday after releasing May 2022 metrics which showed a slowing of all major metrics including...,by Investing.com Staff Shares of Roblox (NYSE:RBL,0.0
2022-06-17,17,6,2022,24.690000534057617,-0.054747329985834314,0.0,-0.4215,Roblox Stock Downgraded to Hold at Truist on Valuation and Competition,By Senad Karaahmetovic Truist analyst Matthew Thornton cut rating on RobloxÂ Corp (NYSE:RBLX) shares to Hold from Buy after weak May metrics. The analyst has a $29.00 per share...,Matthew Thornton cut rating on shares to hold from Buy after weak metrics . the analyst has,1.0
2022-07-14,14,7,2022,37.08000183105469,0.5018226419195977,0.5574,0.296,Analysts Raise Roblox Price Targets as Developers Positive on Monetization,By Sam Boughedda Analysts at both BofA and Needham raised their price targets on RobloxÂ Corp (NYSE:RBLX) shares Thursday with one stating that the majority of developers were more...,analysts at both BofA and Needham raised their price targets on Roblox Corp ,1.0
2022-08-10,10,8,2022,47.34999847412109,0.2769686120798738,-0.296,-0.25,Roblox Sinks on Weak Q2 Results Analyst Cautious on Scale and Profitability Runway,By Senad Karaahmetovic Â  Shares of Roblox (NYSE:RBLX) are down almost 15% in premarket Wednesday trading after the internet company reported disappointing results. Bookings came in...,shares of Roblox (NYSE:RBLX) are down almost 15% in premarket trading,1.0
2022-09-09,9,9,2022,41.86000061035156,-0.11594504837777464,0.0,0.0,Roblox Plans to Debut Ads on its Platform Next Year,By Sam Boughedda RobloxÂ Corp (NYSE:RBLX) said Friday that it intends to have ads on its platform next year its first notable effort to diversify revenue beyond virtual goods in...,Sam Boughedda Roblox Corp (NYSE:RBLX) intend,1.0
2022-09-12,12,9,2022,45.52999877929688,0.08767315134815745,-0.4767,0.296,Roblox Slips as Cowen Starts at Underperform Sees Over 30% Downside Risk,By Senad Karaahmetovic Shares of RobloxÂ Corp (NYSE:RBLX) are down over 1.5% in early Monday trading after a Cowen analyst initiated research coverage with an Underperform...,shares of Roblox Corp (NYSE:RBLX) are down over 1.5% in,0.0
2022-09-13,13,9,2022,46.56999969482422,0.02284210286428201,0.1531,0.0772,Roblox Immersive Ads Execution Will be Challenging - Morgan Stanley,By Sam Boughedda Reacting to the announcement on Friday at the RobloxÂ Corp (NYSE:RBLX) Developers Conference that the company plans to test Immersive Ads with a small number of...,the company plans to test Immersive Ads with a small number of...,0.0
2022-09-16,16,9,2022,43.5,-0.06592226143315649,0.1779,0.296,Morgan Stanley Cautious on Roblox Scale and Profitability Runway,By Sam Boughedda RobloxÂ Corp (NYSE:RBLX) shares are down more than 8% Friday following its investor day and August metrics report after the close Thursday. Following the company's...,by Sam Boughedda Roblox shares are down more than 8% Friday,0.0
2022-09-26,26,9,2022,35.540000915527344,-0.18298848470052087,0.0,0.34,Walmart Moves into the Metaverse with Launch of Roblox Experiences,By Sam BougheddaÂ  Walmart (NYSE:WMT) announced the launch of metaverse experiences Walmart Land and Walmart's Universe of Play on the Roblox (NYSE:RBLX) gaming platform. The move...,metaverse experiences Walmart Land and Walmart's universe of play are being launched on the Roblox,1.0
2022-10-03,3,10,2022,35.84000015258789,0.008441171337434605,-0.2516,0.296,Roblox Rated Underperform at MoffettNathanson Analysts See Near 50% Downside Risk | Today's Most Important Initiations,By Senad Karaahmetovic MoffettNathanson analysts initiated research coverage on Roblox (NYSE:RBLX) with an Underperform rating and a $19 per share price target. While the analysts... | By Davit Kirakosyan MoffettNathanson initiated coverage on  Roblox Corp  (NYSE:RBLX) with an Underperform rating and a $19 price target. ÂWeÂre just not sure...,analysts initiated research coverage on Roblox (NYSE:RBLX) with an Underperform rating and a,1.0
2022-10-11,11,10,2022,35.400001525878906,-0.012276747344746153,0.296,0.296,Roblox Shares are 'Overvalued' Says Barclays and Starts at Underweight,By Senad Karaahmetovic Shares of Roblox (NYSE:RBLX) are down 4% in pre-open Tuesday trading after Barclays analysts initiated research coverage at Underweight. The price target of...,shares of Roblox (NYSE:RBLX) are down 4% in pre-open,1.0
2022-10-17,17,10,2022,35.560001373291016,0.0045197695060872345,0.4939,0.8555,Roblox Stock Gains 15% After Reporting 23% Jump in DAUs for September | TodayÂs Important Price Target Changes,By Senad Karaahmetovic Shares of RobloxÂ Corp (NYSE:RBLX) are up about 15% in pre-open Monday after the company reported a strong jump in September daily active users (DAUs). Roblox... | By Davit Kirakosyan Wedbush raised the price target on RobloxÂ Corp (NYSE:RBLX) to $36.00 from $34.00 while maintaining a Neutral rating. Shares surged nearly 20% today after the...,shares of Roblox Corp (NYSE:RBLX) are up about 15% in pre-open Monday . the company reported ,1.0
2022-10-26,26,10,2022,45.709999084472656,0.28543299547803924,0.4215,-0.0772,Roblox Has a Large Global User and Monetization Upside Opportunity - Piper Sandler,By Sam BougheddaÂ  Piper Sandler analysts started shares of Roblox (NYSE:RBLX) at Overweight with a $54 price target in a note to clients on Wednesday. The analysts described Roblox...,analysts started shares of Roblox (NYSE:RBLX) at Overweight . analysts,1.0
2022-11-09,9,11,2022,39.13999938964844,-0.1437322210985561,-0.0258,0.1531,Roblox shares tumble on wider-than-expected loss,By Sam Boughedda RobloxÂ Corp (NYSE:RBLX) shares tumbled early Wednesday following the company's third-quarter earnings release which saw it miss analyst consensus estimates. The...,by Sam Boughedda Roblox shares tumbled after third quarter earnings release,0.0
2022-11-10,10,11,2022,30.920000076293945,-0.21001531531777384,0.3818,-0.2023,Roblox bar for growth much higher than JPMorgan thought,By Sam Boughedda JPMorgan downgraded shares of RobloxÂ Corp (NYSE:RBLX) to Neutral from Overweight cutting its price target on the stock to $35 from $53 in a note to clients on...,sam Boughedda JPMorgan downgraded shares of Roblox,1.0
2022-12-15,15,12,2022,33.130001068115234,0.07147480550996743,0.296,0.296,Roblox shares tumble following 'disappointing' November metrics,By Sam BougheddaÂ  RobloxÂ (NYSE:RBLX) shares tumbled in early Thursday trading after the company reported its key metrics for November with the company impacted by foreign exchange...,shares tumbled after the company reported its key metrics for November with the company impacted by foreign,0.0
2023-01-17,17,1,2023,33.209999084472656,0.00241466989973671,0.5106,0.0,Roblox stock surges 15% after strong December metrics,By Senad Karaahmetovic Roblox (NYSE:RBLX) is trading sharply higher in pre-open Tuesday after the company presented key metrics for the month of December 2022. Roblox reported the...,Senad Karaahmetovic Roblox (NYSE:RBLX) is trading,1.0
2023-01-19,19,1,2023,35.7599983215332,0.07678408031793049,-0.6369,0.1779,"Risk-reward for Roblox ""turned sharply negative"" - Morgan Stanley downgrades lowers target",By Vlad Schepkov  Morgan Stanley analysts downgraded Roblox Corporation (NYSE:RBLX) to 'Underweight' from 'Equal-weight' and lowered their Price Target on the shares to $24 from...,analysts downgrade Roblox Corporation (NYSE:RBLX) to 'Underweight,0.0
2023-02-13,13,2,2023,34.81999969482422,-0.026286316298369528,-0.368,-0.7034,Bank of America bullish on Roblox; Looks for strong 4Q report,By Michael Elkins Bank of America reiterated a Buy rating and $54.00 price target on RobloxÂ Corp (NYSE:RBLX) ahead of the companyÂs 4Q earnings release. Roblox will report 4Q22...,Michael Elkins Bank of America reiterated a Buy rating and $54.00 price target on,1.0
2023-02-16,16,2,2023,45.08000183105469,0.29465830632260337,0.0,0.296,Benchmark upgrades Roblox stock after a 26% rally yesterday,By Senad Karaahmetovic Benchmark analysts upgraded Roblox (NYSE:RBLX) shares to Hold from Sell after the company reported better-than-expected Q4 results yesterday. As a result...,analysts upgraded Roblox (NYSE:RBLX) shares to Hold from Sell . the,0.0
2023-03-10,10,3,2023,39.93999862670898,-0.1140195873018991,0.0,0.6486,Jefferies says Roblox is an internet not a gaming company; upgrades to Buy,By Senad Karaahmetovic Jefferies analysts upgraded Roblox (NYSE:RBLX) stock to Buy from Hold with the price target raised by 60% to $48 per share. They see a favorable narrative...,analysts upgraded Roblox stock to Buy from Hold with the price target raised by 60% to $48,1.0
2023-03-15,15,3,2023,43.18999862670898,0.08137206088501547,0.1531,0.0,Roblox: February metrics seen as solid and in line with consensus,By Senad KaraahmetovicÂ  Roblox (NYSE:RBLX) expects to report booking for February of $245 million (up or down $2M) the company said today. Revenue is seen in the range of...,revenue is seen in the range of $245 million booking for February .,1.0
2023-03-16,16,3,2023,42.720001220703125,-0.010882088931468581,0.0,0.0,Roblox remains Underweight at Morgan Stanley following in-line February metrics,By Michael Elkins Morgan Stanley reiterated an Underweight rating and $26.00 price target on RobloxÂ Corp (NYSE:RBLX) after the video game company reported February metrics that...,the video game company reported an underweight rating and $26.00 price target on Roblox,1.0
2023-03-23,23,3,2023,42.84999847412109,0.003043006781445534,0.0,0.0,Roblox faces potential competition from Epic Games claims Morgan Stanley,By Sam Boughedda Morgan Stanley analystsÂ told investors on ThursdayÂ that RobloxÂ Corp (NYSE:RBLX) is facing competition after Epic Games announced it would roll out a new way of...,Roblox Corp (NYSE:RBLX) is facing competition after Epic Games announced it,1.0
2023-04-17,17,4,2023,45.70000076293945,0.0665111409639747,0.0,0.296,Roblox stock tumbles 12% after reporting key user metrics for March,By Senad KaraahmetovicÂ  RobloxÂ (NYSE:RBLX) shares are down nearly 12% in pre-open Monday after the video game developer reported key user metrics for March. Roblox reported 66.2...,video game developer reported key user metrics for march . shares are down nearly 12% in pre,0.0
2023-05-08,8,5,2023,35.04999923706055,-0.23304160499085935,0.3612,0.4215,Roblox - BTIG analysts 'like the setup heading into the print',BTIG analysts said the firm likes the setup for RobloxÂ Corp (NYSE:RBLX) into the company's upcoming earnings release on Wednesday May 10. The firm raised estimates for the online...,BTIG analysts say the firm likes the setup for Roblox Corp (NYSE:,1.0
2023-05-10,10,5,2023,36.18999862670898,0.03252494763089864,-0.0258,0.25,Roblox reports wider-than-expected loss in Q1 shares recover after initial slide,Roblox (NYSE:RBLX) shares plunged premarket after reporting a worse-than-expected loss per share in the first quarter. The online game platform reported a loss per share of $0.44...,the online game platform reported a loss per share of $0.44 in the first quarter .,1.0
2023-05-11,11,5,2023,38.869998931884766,0.07405361721118964,0.5106,0.0,Analysts bullish on Roblox following strong bookings incoming inflection point,Roblox (RBLX) was upgraded to Buy with a $45 price target at Benchmark on Thursday while Roth MKM also lifted the stock to Buy raising the price target to $48 from $37 following...,Roblox (RBLX) was upgraded to Buy with a $45 price target at,1.0
2023-06-13,13,6,2023,38.95000076293945,0.0020581896900713215,0.0,0.4215,Roblox fetches new 'Buy' rating from Canaccord Genuity,Analysts at Canaccord Genuity initiated coverage on online entertainment platform Roblox Corp. (NYSE:RBLX) with a Buy rating and a price target of $48. The price target is based on...,analysts at canaccord Genuity initiated coverage on online entertainment platform Roblox Corp.,1.0
2023-06-29,29,6,2023,40.02000045776367,0.027471108443271497,0.6369,0.0,Clear potential benefits for Roblox from AI tools says Morgan Stanley,Morgan Stanley revealed it hosted a non-deal roadshow (NDR) with RobloxÂ Corp (NYSE:RBLX) CTO Dan Sturman and CFO Mike Guthrie focusing on the company's AI initiatives/investments...,Morgan Stanley hosted a non-deal roadshow (NDR) with Roblox Corp,1.0
2023-07-05,5,7,2023,42.09999847412109,0.05197396283272426,0.2023,0.2023,Roblox a top pick at BTIG for H2 as drivers not reflected in consensus,Buy-rated Roblox (NYSE:RBLX) was named as one of BTIG's top picks for the second half of 2023 the firm revealed in a note Wednesday. The firm's analysts who have a $60 price...,buy-rated Roblox named as one of BTIG's top picks for 20,0.0
2023-08-09,9,8,2023,37.7400016784668,-0.10356287300899514,0.0,-0.25,Roblox stock drops 7% as Q2 results trail analyst estimates,Roblox (NYSE:RBLX) shares fell more than 7% in pre-market trading after the company reported second quarter results. Roblox posted a loss per share of 46 cents worse than the...,shares fell more than 7% in pre-market trading after the company reported second quarter results ,0.0
2023-08-10,10,8,2023,29.459999084472656,-0.21939592543045483,0.0,0.296,Analysts rush to upgrade Roblox stock after earnings-fueled selloff,Roblox (NYSE:RBLX) shares fell as much as 22% on Wednesday after the company delivered a soft earnings report for its second quarter. This sell-off has been seen as an opportunity...,Roblox (NYSE:RBLX) shares fell as much as 22% on Wednesday ,1.0
2023-09-11,11,9,2023,29.01000022888184,-0.015274910711996492,0.0,0.0,Morgan Stanley attends Roblox developer conference; remains Equal-Weight,Morgan Stanley reiterated an Equal-Weight rating on Roblox Corporation (NYSE:RBLX) with a 12-month price target of $30.00 on the stock after the American video game developer...,Morgan Stanley reiterated an Equal-Weight rating on Roblox Corporation (NYSE:RBL,1.0
2023-09-12,12,9,2023,28.549999237060547,-0.01585663523584957,0.0,0.0,Roblox Connect 'could be a major milestone for the platform' - Oppenheimer,In a note to clients on Tuesday Oppenheimer analysts posed the question as to whether Roblox (NYSE:RBLX) can take on WeChat or WhatsApp. The company revealed Roblox Connect last...,analysts pose the question as to whether Roblox can take on weChat or WhatsApp .,0.0
