Date,day,month,year,Close Before,Before_change,SA_T,SA_S,Title,Content,summary,Label
2023-08-01,1,8,2023,18.520000457763672,-0.03138077171202591,0.4588,0.8834,Marriott lifts annual income guidance amid solid travel demand | Marriott Int earnings beat by $0.09 revenue topped estimates | Marriott lifts annual profit forecast on China rebound,Investing.com -- Marriott International Inc. (NASDAQ:MAR) has lifted its full-year profit guidance in a sign that the hotel chain is reaping the benefits from a surge in travel... | Investing.com - Marriott Int (NASDAQ: MAR) reported second quarter EPS of $2.26 $0.09 better than the analyst estimate of $2.17. Revenue for the quarter came in at $6.08B versus... | By Doyinsola Oladipo and Priyamvada C (Reuters) -Marriott International raised its full-year profit forecast on Tuesday as the U.S. hotel operator bets on higher room rates and...,Investing.com - Marriott int (NASDAQ: MAR) reported second quarter EPS of $2.26 $0.09 better than the analyst estimate of 2.17 . revenue for the quarter,0.0
2023-08-11,11,8,2023,15.0,-0.19006481483579396,0.0,0.0,BYD calls on China automakers to unite 'demolish the old' in global push,"(Reuters) - A patriotic call by China's bestselling automaker to band the industry together and ""demolish the old legends"" of the global market has gone viral drawing both raves...","automaker calls to ""demolish the old legends"" of the global market .",0.0
2023-08-14,14,8,2023,15.229999542236328,0.015333302815755179,0.5267,-0.296,4 big analyst cuts: For Marriott 'shorter-term upside is limited' says Bernstein | Bernstein downgrades Marriott after a strong run promotes Hyatt to Top Pick,Here is your Pro Recap of the biggest analyst cuts you may have missed since Friday: downgrades at Marriott Forward Air Public Service Enterprise and Mosaic.InvestingPro... | Bernstein analysts revisited the firms research coverage of the Global Hotels & Leisure sector prompting him to make some changes. Marriott (NASDAQ:MAR) shares fell more than...,analysts revisited the firm's research coverage of the global hotels & leisure sector prompting him to make some changes,0.0
2023-09-22,22,9,2023,9.579999923706056,-0.3709783183421319,0.296,0.5994,Samhi Hotels lists shares on stock exchange following oversubscribed IPO,Samhi Hotels a major player in India's hospitality sector with stakes in Fairfield by Marriott and Holiday Inn Express brands listed its shares on the stock exchange on Friday....,Samhi Hotels a major player in the hospitality sector with stakes in fairfield by,0.0
2023-09-27,27,9,2023,9.0600004196167,-0.05427969814515343,0.836,0.6369,Marriott projects upbeat revenue per room growth as travel demand stays strong | Marriott outlines 3-year growth plan says travel demand remains robust,(Reuters) - Marriott International (NASDAQ:MAR) on Wednesday forecast two-year annualized global revenue per available room (RevPAR) growth of 3% to 6% by 2025 as the hotel... | Marriott (NASDAQ:MAR) reiterated its 2023 outlook and outlined its three-year growth plan in a press release and presentation Wednesday morning. Presenting at its meeting with...,Marriott International (NASDAQ:MAR) reiterated its 2023 outlook and outlined its three-year growth plan in a,1.0
2023-10-03,3,10,2023,9.880000114440918,0.09050768839356316,0.0,0.2023,Marriott American Express and Morgan Stanley see surge in options trading volumes,Significant options trading volumes were observed on Tuesday in Marriott International (NASDAQ:MAR)  American Express  Co. (NYSE:NYSE:AXP) and Morgan Stanley (NYSE:MS)...,major options trading volumes were observed on Tuesday in Marriott International (NASDAQ:MAR) American Express Co,0.0
2023-11-02,2,11,2023,10.210000038146973,0.03340080160765546,0.4404,0.7003,Marriott Int earnings beat revenue topped estimates | Marriott's third-quarter profit rises on higher room rates group travel,Investing.com - Marriott Int (NASDAQ: MAR) reported third quarter EPS of $2.11 better than the analyst estimate of $2.10. Revenue for the quarter came in at $5.93B versus the... | By Doyinsola Oladipo and Priyamvada C (Reuters) -Marriott International reported a rise in third-quarter profit on Thursday as the hotel operator benefited from pricier rooms and...,revenue for the quarter came in at $5.93B versus the analyst estimate of $2.10 . a rise in third,1.0
2023-11-03,3,11,2023,11.300000190734863,0.10675809485948995,0.802,0.5106,Earnings call: Marriott International reports strong Q3 results optimistic about future growth,Marriott International (NASDAQ:MAR) has reported strong third-quarter results with global RevPAR (revenue per available room) increasing by 9% compared to 2022. The company's...,global RevPAR (revenue per available room) increased by 9% compared to 20,0.0
2023-11-09,9,11,2023,10.279999732971191,-0.0902655257121141,0.34,0.6124,Chariot Corporation initiates first-pass diamond drilling at Black Mountain project,ASX-listed Chariot Corporation the largest holder of lithium exploration assets in America has begun first-pass diamond drilling at its primary Black Mountain project in Wyoming....,ASX-listed Chariot Corporation the largest holder of lithium exploration assets in America has begun,1.0
2023-11-13,13,11,2023,10.359999656677246,0.0077820939478694395,0.4019,0.3182,Boeing to boost production capacity for Patriot missile sensors | Patriot Hydrogen prepares for London Stock Exchange listing in 2024,(Reuters) - Boeing (NYSE:BA) said on Monday it will increase Huntsville factory production capacity for sensors that are used to guide Patriot missiles to their targets to meet... | LONDON  Patriot Hydrogen Ltd is advancing towards a direct listing on the London Stock Exchange slated for the first half of 2024 with Cronin Capital orchestrating pre-listing...,Boeing (NYSE:BA) said on Monday it will increase Huntsville factory production capacity for sensors used to guide Patriot missiles to their,0.0
2023-12-04,4,12,2023,13.770000457763672,0.329150667383334,-0.3182,-0.4215,Riot Platforms secures major Bitcoin miner order,NEW YORK - Riot Platforms (NASDAQ: NASDAQ:RIOT) has announced an expanded collaboration with MicroBT Electronics Technology Co. LTD marking a significant step in its strategic...,Riot Platforms (NASDAQ: NASDAQ:RIOT) has announced an expanded collaboration with,1.0
2023-12-05,5,12,2023,15.0,0.08932458252336817,0.6249,0.128,Blackstone buys Kyoto Moxy Nijo hotel for $54 million amid tourism boom | Hyatt Hotels the preferred hotel name at Wells Fargo due to favorable exposure,TOKYO - Blackstone (NYSE:BX) Inc. has acquired the Moxy Kyoto Nijo a Marriott International (NASDAQ:MAR) hotel for ¥8 billion ($54 million) tapping into the flourishing... | Wells Fargo initiated Hyatt Hotels (NYSE:H) at Overweight and Hilton (HLT) and Marriott (MAR) at Equal Weight in a note covering hotel stocks on Tuesday. Analysts at Wells Fargo...,blackstone (NYSE:BX) Inc. has acquired the Moxy Kyoto Nijo a Marriott International (NASDAQ:MAR,0.0
2024-01-22,22,1,2024,10.289999961853027,-0.31400000254313154,-0.5574,-0.5574,Tencent's Riot Games to lay off about 11% of staff,(Reuters) -Tencent Holdings' Riot Games plans to lay off 530 employees or about 11% of its staff globally the online gaming company said on Monday in a blog that included a...,Riot Games plans to lay off 530 employees or about 11% of its staff globally ,1.0
2024-02-12,12,2,2024,14.550000190734863,0.41399419287409733,0.0,0.0,Earnings To Watch: Marriott (MAR) Reports Q4 Results Tomorrow,Global hospitality company Marriott (NASDAQ:MAR)   will be reporting results tomorrow morning. Here's what investors should know. Last quarter Marriott reported...,NASDAQ:MAR will be reporting results tomorrow morning . last quarter Marriott reported...,1.0
2024-02-13,13,2,2024,15.920000076293944,0.0941580665017081,0.8176,0.9595,Earnings call: Marriott sees robust growth strong RevPAR in Q4 | Marriott's 2024 profit forecast lags estimates as US demand moderates | Marriott Int earnings beat by $1.45 revenue fell short of estimates | JMP Securities sees 17.6% upside in Marriott Vacations stock | Marriott Misses Revenue Estimates For Q4 FY,Marriott International Inc. (NASDAQ:MAR) has reported a strong financial performance for the fourth quarter of 2023 with significant increases in global revenue per available... | By Doyinsola Oladipo and Aishwarya Jain (Reuters) -Hotel operator Marriott International (NASDAQ:MAR) forecast 2024 profit below Wall Street expectations on Tuesday as U.S. room... | Investing.com - Marriott Int (NASDAQ: MAR) reported fourth quarter EPS of $3.57 $1.45 better than the analyst estimate of $2.12. Revenue for the quarter came in at $6.09B versus... | On Tuesday JMP Securities initiated coverage on shares of Marriott Vacations Worldwide (NYSE:VAC) assigning a Market Outperform rating and setting a price target of $105.00. The... | BETHESDA - Marriott International Inc. (NASDAQ:MAR) reported a robust increase in its adjusted earnings per share (EPS) for the fourth quarter surpassing analyst expectations....,Marriott International reported a strong financial performance for the fourth quarter of 2023 with significant increases in global revenue per available... | Investing.com - Marriott Int (NASDAQ: MAR) reported fourth quarter EPS of $3.57 $1.45 better than the analyst estimate of $2.12 .,1.0
2024-02-21,21,2,2024,16.040000915527344,0.007537741121753427,0.0,0.0,Marriott Vacations (NYSE:VAC) Beats Q4 Sales Targets,Vacation ownership company Marriott Vacations (NYSE:VAC)   beat analysts' expectations in Q4 FY2023 with revenue flat year on year at $1.19 billion.  It made a...,Marriott Vacations beat analysts' expectations in Q4 FY2023 with revenue flat year on year,0.0
2024-02-22,22,2,2024,15.100000381469728,-0.05860352122222501,0.296,0.0,Why Are Marriott Vacations (VAC) Shares Soaring Today,What Happened:Shares of vacation ownership company Marriott Vacations (NYSE:VAC)   jumped 9.2% in the afternoon session after the company reported fourth-quarter...,shares of Marriott Vacations (NYSE:VAC) jumped 9.2% in the afternoon session,0.0
2024-02-23,23,2,2024,15.729999542236328,0.04172179767225148,0.4404,0.7269,Earnings call: Marriott Vacations reports growth amidst challenges,Marriott Vacations Worldwide (NYSE: VAC) discussed its Fourth Quarter 2023 results highlighting a 4% increase in contract sales and successful initiatives despite the impact of...,Marriott Vacations Worldwide (NYSE: VAC) discussed its fourth quarter 2023 results .,1.0
2024-02-26,26,2,2024,14.850000381469728,-0.05594400421969059,0.1027,0.5719,Marriott expands footprint in Caribbean and Latin America,PLANTATION Fla. - Marriott International (NASDAQ:MAR) reported a year of significant growth in the Caribbean and Latin America (CALA) for 2023 with a nearly doubled number of...,a year of significant growth in the Caribbean and Latin America (CALA) for 2023,1.0
2024-02-27,27,2,2024,17.3700008392334,0.16969699616359613,-0.5994,-0.7184,Riot Platforms stock target raised to $20 on strong Bitcoin prices | Riot Platforms stock target raised to $25.50,On Tuesday Singular Research adjusted its stock price target on shares of Riot Platforms (NASDAQ:RIOT) a cryptocurrency mining company raising it slightly to $20.00 from the... | On Tuesday Roth/MKM maintained a Buy rating on Riot Platforms (NASDAQ:RIOT) and raised the stock price target to $25.50 up from the previous $22.50. The adjustment follows the...,Singular Research adjusted its stock price target on shares of Riot Platforms (NASDAQ:RIOT) a cryptocurrency mining,0.0
2024-02-28,28,2,2024,16.799999237060547,-0.032815289270763714,0.0772,-0.0516,Truist gives Riot Platforms a boost sees shares doubling in 2 years,On Wednesday Truist Securities updated its outlook on Riot Platforms (NASDAQ:RIOT) a technology-focused company increasing the share price target to $110 from the previous $90...,Truist Securities updated its outlook on Riot Platforms (NASDAQ:RIOT) .,0.0
2024-03-12,12,3,2024,11.779999732971191,-0.298809507860888,-0.0516,-0.0516,Reformed Energy secures investment from Riot Platforms,HOUSTON - Reformed Energy Inc. a Texas-based waste-to-energy firm has recently obtained a strategic investment from Riot Platforms (NASDAQ:RIOT) Inc. a prominent Bitcoin mining...,a Texas-based waste-to-energy firm has recently obtained a strategic investment from,0.0
2024-03-14,14,3,2024,11.729999542236328,-0.0042444984608036584,0.3612,0.6808,Marriott Vacations completes $430 million loan securitization | Marriott director Eric Hippeau sells $351k in company stock | PublicSquare completes Credova acquisition to expand BNPL options,ORLANDO - Marriott Vacations Worldwide Corporation (NYSE: VAC) a leading global vacation company has successfully completed a securitization of vacation ownership loans totaling... | In a recent transaction on March 13 Eric Hippeau a member of the board of directors at Marriott International Inc. (NASDAQ:MAR) sold 1400 shares of the company's stock. The... | WEST PALM BEACH Fla. - PSQ Holdings Inc. (NYSE: PSQH) known as PublicSquare a marketplace connecting patriotic businesses and consumers has finalized the acquisition of...,a member of the board of directors at Marriott International Inc. sold 1400 shares of the company's stock . the company has successfully completed a securitization of vacation,0.0
2024-03-19,19,3,2024,11.43000030517578,-0.025575383526686313,-0.5574,-0.34,Riot platforms executive sells $390k in company stock,In a recent transaction on March 15 Ryan D. Werner the Senior Vice President and Chief Accounting Officer of Riot Platforms Inc. (NASDAQ:RIOT) sold 35000 shares of the...,"Ryan D. Werner, senior vice president and chief accounting officer of Riot Platforms Inc",1.0
2024-03-20,20,3,2024,11.09000015258789,-0.029746294270344698,0.0516,-0.7269,JPMorgan upgrades Riot Platforms stock on hashrate growth prospects,On Wednesday JPMorgan made a notable change to its rating on Riot Platforms (NASDAQ:RIOT) upgrading the stock from Neutral to Overweight and setting a price target of $15.00....,"on Wednesday, JPMorgan made a notable change to its rating on Riot Platforms",1.0
2024-03-21,21,3,2024,12.399999618530272,0.11812438664725255,0.128,0.5574,Raytheon lands $1.2 billion contract for German defense,TUCSON Ariz. - Raytheon Technologies Corporation (NYSE: NYSE:RTX) has secured a contract worth $1.2 billion to supply Germany with additional Patriot air and missile defense...,RTX has secured a contract worth $1.2 billion to supply Germany with additional Patriot air,0.0
2024-04-12,12,4,2024,9.75,-0.2137096532301641,-0.0258,0.6249,AstraZeneca CEO could earn 19 million pounds as pay measure clears opposition,(Reuters) -AstraZeneca shareholders on Thursday approved a 2024 pay policy which will boost CEO Pascal Soriot's remuneration to as much as 18.9 million pounds ($23.7 million) this...,shareholders approve 2024 pay policy which will boost remuneration to 18.9 million pounds,0.0
2024-04-22,22,4,2024,9.130000114440918,-0.0635897318522135,-0.5574,0.0,After-hours movers: Cadence Design Systems Cleveland-Cliffs Riot Platforms and more,After-Hours Stock Movers: Cadence Design Systems (NASDAQ:CDNS) declined 8% after the chip design software company published second quarter and full year guidance that was below...,after-Hours Stock Movers: Cadence Design Systems (NASDAQ:CDNS) declined ,1.0
2024-04-30,30,4,2024,11.079999923706056,0.2135815755556043,0.0,-0.296,Earnings To Watch: Marriott (MAR) Reports Q1 Results Tomorrow,Global hospitality company Marriott (NASDAQ:MAR)   will be announcing earnings results tomorrow before the bell. Here's what to look for. Marriott missed analysts'...,global hospitality company will announce earnings results tomorrow before the bell . analysts'...,0.0
2024-05-01,1,5,2024,10.109999656677246,-0.08754515105667648,0.9744,0.8979,Earnings call: Marriott reports strong start to 2024 with global RevPAR growth | Earnings call: Marriott reports strong start to 2024 with global RevPAR growth | Earnings call: Marriott reports strong start to 2024 with global RevPAR growth | Marriott Int earnings missed by $0.04 revenue topped estimates | Marriot delivers mixed Q1 results hikes profit outlook; shares down | Marriott's (NASDAQ:MAR) Q1 Earnings Results: Revenue In Line With Expectations | Marriott boosts full-year profit view after mixed Q1 results,Marriott International Inc. (NASDAQ:MAR) has announced a robust beginning to 2024 with a global revenue per available room (RevPAR) increase of 4.2% in the first quarter. The... | Marriott International Inc. (NASDAQ:MAR) has announced a robust beginning to 2024 with a global revenue per available room (RevPAR) increase of 4.2% in the first quarter. The... | Marriott International Inc. (NASDAQ:MAR) has announced a robust beginning to 2024 with a global revenue per available room (RevPAR) increase of 4.2% in the first quarter. The... | Investing.com - Marriott Int (NASDAQ: MAR) reported first quarter EPS of $2.13 $0.04 worse than the analyst estimate of $2.17. Revenue for the quarter came in at $5.98B versus the... | Marriott (MAR) posted a first-quarter earnings per share (EPS) that missed analyst expectations sending its shares 1.5% lower in premarket trading. The earnings outlook for the... | Global hospitality company Marriott (NASDAQ:MAR)   reported results in line with analysts' expectations in Q1 CY2024 with revenue up 6.4% year on year to $5.98... | By Aishwarya Jain and Doyinsola Oladipo (Reuters) -Hotel operator Marriott International (NASDAQ:MAR) raised its forecast for annual adjusted profit on Wednesday after mixed...,the... | Marriott International Inc. (NASDAQ:MAR) has announced a robust beginning to 2024 with a global revenue per available room (RevPAR) increase of 4.2% in the first quarter . revenue for the quarter came in at $5.98B versus the... .,1.0
2024-05-06,6,5,2024,10.420000076293944,0.030662752734314402,0.0,0.0,Marriott Vacations (NYSE:VAC) Exceeds Q1 Expectations,Vacation ownership company Marriott Vacations (NYSE:VAC)   reported results ahead of analysts' expectations in Q1 CY2024 with revenue up 2.2% year on year to $1.20...,Marriott Vacations (NYSE:VAC) reported results ahead of analysts' expectations in Q1,0.0
2024-05-07,7,5,2024,10.770000457763672,0.03358928780298176,0.9719,0.9912,Earnings call: Marriott Vacations reports growth and new developments | Earnings call: Marriott Vacations reports growth and new developments | Earnings call: Marriott Vacations reports growth and new developments | Earnings call: Marriott Vacations reports growth and new developments | Earnings call: Marriott Vacations reports growth and new developments | Earnings call: Marriott Vacations reports growth and new developments | Earnings call: Marriott Vacations reports growth and new developments | Earnings call: Marriott Vacations reports growth and new developments | Earnings call: Marriott Vacations reports growth and new developments | Earnings call: Marriott Vacations reports growth and new developments,Marriott Vacations Worldwide (NYSE: VAC) reported steady growth and strategic developments in its first-quarter 2024 earnings call. The company saw a 3% increase in contract sales... | Marriott Vacations Worldwide (NYSE: VAC) reported steady growth and strategic developments in its first-quarter 2024 earnings call. The company saw a 3% increase in contract sales... | Marriott Vacations Worldwide (NYSE: VAC) reported steady growth and strategic developments in its first-quarter 2024 earnings call. The company saw a 3% increase in contract sales... | Marriott Vacations Worldwide (NYSE: VAC) reported steady growth and strategic developments in its first-quarter 2024 earnings call. The company saw a 3% increase in contract sales... | Marriott Vacations Worldwide (NYSE: VAC) reported steady growth and strategic developments in its first-quarter 2024 earnings call. The company saw a 3% increase in contract sales... | Marriott Vacations Worldwide (NYSE: VAC) reported steady growth and strategic developments in its first-quarter 2024 earnings call. The company saw a 3% increase in contract sales... | Marriott Vacations Worldwide (NYSE: VAC) reported steady growth and strategic developments in its first-quarter 2024 earnings call. The company saw a 3% increase in contract sales... | Marriott Vacations Worldwide (NYSE: VAC) reported steady growth and strategic developments in its first-quarter 2024 earnings call. The company saw a 3% increase in contract sales... | Marriott Vacations Worldwide (NYSE: VAC) reported steady growth and strategic developments in its first-quarter 2024 earnings call. The company saw a 3% increase in contract sales... | Marriott Vacations Worldwide (NYSE: VAC) reported steady growth and strategic developments in its first-quarter 2024 earnings call. The company saw a 3% increase in contract sales...,the company saw a 3% increase in contract sales... | Marriott Vacations Worldwide (NYSE: VAC) reported steady growth and strategic developments in its first-quarter 2024 earnings call .,0.0
2024-05-29,29,5,2024,10.34000015258789,-0.03992574623019729,-0.886,-0.9643,Bitfarm rejects Riots acquisition bid says it undervalues the company | Bernstein SocGen Group Reiterates Outperform Rating on Riot Platforms | Bernstein SocGen Group Reiterates Outperform Rating on Riot Platforms,"Bitfarms (BITF) has rejected Riot Platforms' (NASDAQ:RIOT) unsolicited offer to acquire the Bitcoin miner at $2.30 per share in cash and stock claiming the proposal significantly... | Bernstein SocGen Group analysts reiterated an Outperform rating and $22.00 price target on Riot Platforms (NASDAQ:RIOT) The analysts comment ""Riot announced a 9.25% stake in... | Bernstein SocGen Group analysts reiterated an Outperform rating and $22.00 price target on Riot Platforms (NASDAQ:RIOT) The analysts comment ""Riot announced a 9.25% stake in...","Bitfarms has rejected the unsolicited offer to acquire the Bitcoin miner at $2.30 per share in cash and stock . analysts comment ""Riot announced ",0.0
2024-06-05,5,6,2024,9.670000076293944,-0.06479691164475077,-0.5574,-0.34,Riot Platforms stock slides after Kerrisdale Capital reveals short position,"Riot Platforms (NASDAQ:RIOT) shares fell more than 5% Wednesday after Kerrisdale Capital said it is short the bitcoin miner. The short-selling firm claimed the company ""does a far...","the short-selling firm says the company ""does a far... far...",1.0
2024-06-21,21,6,2024,10.420000076293944,0.07755946164246974,-0.128,-0.2263,Factbox-Patriot in focus amid missile defense system shortage,(Reuters) - As Ukraine's military struggles with a shortage of missile defense systems amid Russia's bombardment of its energy infrastructure Patriot systems which have helped...,Ukraine's military struggles with a shortage of missile defense systems amid Russia's bombardment,0.0
2024-06-24,24,6,2024,9.550000190734863,-0.08349327055557099,-0.5719,-0.5574,Riot Platforms seeks three board seats at Bitfarms after thwarted takeover bid,(Reuters) -Bitcoin miner Riot Platforms (NASDAQ:RIOT) is seeking three board seats at rival Bitfarms a long-sought acquisition target that has rebuffed its $950 million buyout...,miner Riot Platforms is seeking three board seats at rival Bitfarms .,0.0
2024-06-28,28,6,2024,9.119999885559082,-0.045026209066776235,0.4588,0.6249,US army awards Lockheed Martin $4.5 billion multi-year Patriot Missiles contract,(Reuters) -The U.S. Army awarded  Lockheed Martin  (NYSE:LMT) a multi-year contract worth $4.5 billion for its air defense Patriot Missiles system the Pentagon said on Friday....,the contract was worth $4.5 billion for its air defense pat Missiles system . the,1.0
2024-07-11,11,7,2024,9.15999984741211,0.004385960784535126,0.6369,0.4019,Raytheon wins $1.2 billion contract for additional Patriot air missile defense systems to Germany,(Reuters) - RTX's Raytheon Technologies (NYSE:RTX) said on Thursday that it has been awarded a $1.2 billion contract to supply Germany with additional Patriot air and missile...,RTX's Raytheon Technologies has been awarded a $1.2 billion contract to,1.0
2024-07-19,19,7,2024,10.949999809265137,0.1954148462522889,0.0,0.4767,Exclusive-US-Japan Patriot missile production plan hits Boeing component roadblock,By Nobuhiro Kubo and Tim Kelly TOKYO (Reuters) - A U.S. plan to use Japanese factories to boost production of Patriot air defence missiles - used by Ukraine to defend against...,u.s. plan to use Japanese factories to boost production of Patriot air defence missiles,1.0
2024-07-24,24,7,2024,11.59000015258789,0.0584475209562314,-0.128,-0.128,Hotel workers in four US cities to hold strike authorization votes,By Doyinsola Oladipo NEW YORK (Reuters) - About 13500 unionized hotel workers in four U.S. cities plan strike authorization votes next month as contract talks with Marriott...,about 13500 unionized hotel workers in four cities plan strike authorization votes next month as contract talks,0.0
2024-07-31,31,7,2024,10.369999885559082,-0.1052631795484833,-0.4019,0.6124,Marriott Int earnings beat by $0.03 revenue fell short of estimates | Marriott cuts 2024 sales view on soft domestic demand in China North America,Investing.com - Marriott Int (NASDAQ: MAR) reported second quarter EPS of $2.50 $0.03 better than the analyst estimate of $2.47. Revenue for the quarter came in at $6.44B versus... | By Aishwarya Jain (Reuters) -Hotel operator Marriott International (NASDAQ:MAR) lowered its forecast for 2024 room revenue growth on Wednesday citing softer domestic travel...,Investing.com - Marriott int (NASDAQ: MAR) reported second quarter EPS of $2.50,0.0
