Date,day,month,year,Close Before,Before_change,SA_T,SA_S,Title,Content,summary,Label
2024-08-01,1,8,2024,10.1899995803833,-0.017357792397514227,0.3818,0.6124,Earnings call: Marriott International narrows full-year outlook amid growth,Marriott International Inc. (NASDAQ: NASDAQ:MAR) reported a solid performance in the second quarter of 2024 with significant growth in net rooms and global revenue per available...,Marriott International Inc. (NASDAQ: NASDAQ:MAR) reported a solid performance in the,0.0
2024-08-02,2,8,2024,9.31999969482422,-0.08537781367861008,-0.7184,-0.5106,Earnings call: Marriott Vacations reports mixed Q2 results adjusts outlook | PM Starmer warns social media firms after Southport misinformation fuels UK riots,Marriott Vacations Worldwide (NYSE: VAC) has reported mixed financial results for the second quarter of 2024 with rental performance surpassing expectations while lower volume per... | By Alistair Smout and Nick Vant LONDON (Reuters) - British Prime Minister Keir Starmer warned social media companies that they must uphold laws that prohibit the incitement of...,Marriott Vacations Worldwide (NYSE: VAC) has reported mixed financial results for the second quarter of 2024 . rental performance,0.0
2024-08-05,5,8,2024,8.569999694824219,-0.08047210563928531,0.0,-0.5574,Crypto stocks tumble as Bitcoin drops amid broad based selloff,Investing.com -- Crypto stocks Coinbase (NASDAQ:COIN) Bitfarms (NASDAQ:BITF) Riot Platforms (NASDAQ:RIOT) and CleanSpark  (NASDAQ:CLSK) all tumbled more than 10% on Monday as a...,Coinbase (NASDAQ:COIN) and Riot Platforms tumbled more than 10% on,0.0
2024-08-07,7,8,2024,8.40999984741211,-0.018669761156320686,-0.128,-0.3182,Boeing says it's ramping up seeker production as Patriot demand surges,(Reuters) - Boeing (NYSE:BA) on Wednesday said it has been ramping up its production of PAC-3 seekers - critical components used in Patriot interceptors - to meet the surge in...,Boeing (NYSE:BA) has been ramping up its production of PAC-3 seekers ,0.0
2024-08-08,8,8,2024,7.639999866485596,-0.09155766883437633,-0.2732,0.0,Travel companies rein in their forecasts as US consumers cut spending,By Doyinsola Oladipo NEW YORK (Reuters) - Travel companies including Airbnb and Marriott International (NASDAQ:MAR) are forecasting a slowdown in leisure travel as U.S. consumers...,travel companies including Airbnb and Marriott are forecasting a slowdown in leisure travel . the,1.0
2024-08-13,13,8,2024,7.610000133514404,-0.003926666687887215,-0.8689,-0.7717,Bitfarms chair Bonta to step down amid board fight with rival Riot | Bitcoin miner Riot Platforms raises stake in rival Bitfarms to 18.9%,(Reuters) -Bitcoin miner Bitfarms said on Tuesday its co-founder and chair Nicolas Bonta one of the three board members its rival and top shareholder Riot Platforms (NASDAQ:RIOT)... | (Reuters) - Bitcoin miner Riot Platforms (NASDAQ:RIOT) said on Tuesday it had increased its stake in rival Bitfarms to 18.9%. Riot acquired 1 million common shares of Bitfarms on...,bitcoin miner Bitfarms said on Tuesday its co-founder and chair Nicolas Bonta one of the three board members its,1.0
2024-08-14,14,8,2024,7.840000152587891,0.030223392252066716,-0.5574,-0.5994,Bitcoin miner Riot Platforms raises stake in rival Bitfarms to 18.9%,(Reuters) - Bitcoin miner Riot Platforms (NASDAQ:RIOT) said on Tuesday it had increased its stake in rival Bitfarms to 18.9%. Riot acquired 1 million common shares of Bitfarms on...,miner Riot Platforms (NASDAQ:RIOT) acquired 1 million common shares of Bit,0.0
2024-08-15,15,8,2024,7.650000095367432,-0.024234700704405254,0.0,0.5106,US State Dept OKs potential $5 billion sale of Patriot missiles to Germany,WASHINGTON (Reuters) - The U.S. State Department has approved the possible sale of up to 600 Patriot air defense missiles to NATO ally Germany for an estimated cost of $5 billion...,the u.s. state department has approved the sale of up to 600 Patriot air defense,1.0
